{"schemaVersion":2,"repository":{"root":".","identity":"2222222222222222222222222222222222222222222222222222222222222222","scope":"repository"},"source":{"revision":"1111111111111111111111111111111111111111","dirty":false,"statusSummary":[]},"principle":{"path":".cursor/skills/principle-repository/SKILL.md","sha256":null,"version":null,"ratifiedAt":null},"verification":null,"currentState":"surveying","resourceIsolation":"isolated-shell","transitions":[],"artifacts":[],"tools":{"jig":"2","pi":"example","python":"3.10.0"},"createdAt":"2026-09-01T00:00:00Z","updatedAt":"2026-09-01T00:00:00Z"}
